{   
    "entities": 
    [
        {
            "name": "atom",
            "hidden_state_dimension": 16,
            "features":
            [
                {
                    "name": "element",
                    "size": 5
                },
                {
                    "name": "atomic_number"
                },
                {
                    "name": "acceptor"
                },
                {
                    "name": "donor"
                },
                {
                    "name": "aromatic"
                },
                {
                    "name": "hybridization",
                    "size": 3
                }
            ]
        }
    ],

    "message_passing":
        {
            "num_iterations": 8,

            "architecture":
            [
                {
                    "step_name": "step1",
                    "messages":
                    [
                        {
                            "type": "individual",
                            "source_entity": "atom",
                            "destination_entity":"atom",
                            "message_formation": 
                            {
                                "message_neural_net": "yes",
                                "number_extra_parameters": 5,
                                "architecture":
                                [
                                    {
                                        "type":"Dense",
                                        "units": 256,
                                        "kernel_regularizer": 0.1,
                                        "activation": "selu"
                                    },
                                    {
                                        "type":"Dropout",
                                        "rate":0.5
                                    },
                                    {
                                        "type":"Dense",
                                        "kernel_regularizer": 0.01,
                                        "units": 1
                                    }
                                ]
                            },
                            "agregation": "sum",
                            "update": 
                            {
                                "update_type": "recurrent",
                                "recurrent_type": "GRU"
                            },
                            "adj_vector": "adj_atom_atom"
                        }
                    ]
                }
            ]
        },


    "output": 
    [
        {
            "type": "local",
            "entity": "atom",
            "output_label": "mu",
            "output_normalization": "norm_mu",
            "architecture":
            [
                {
                    "type":"Dense",
                    "units": 256,
                    "kernel_regularizer": 0.1,
                    "activation": "selu"
                },
                {
                    "type":"Dropout",
                    "rate":0.5
                },
                {
                    "type":"Dense",
                    "units": 256,
                    "kernel_regularizer": 0.1,
                    "activation": "selu"
                },
                {
                    "type":"Dropout",
                    "rate":0.5
                },
                {
                    "type":"Dense",
                    "kernel_regularizer": 0.01,
                    "units": 1
                }
            ]
        }
    ],
        
    "training_hyperparameters":
    {
        "loss": "MeanSquaredError",
        "optimizer":
        {
            "type": "Adam"
        },
        "schedule": 
        {
            "type": "PolynomialDecay",
            "initial_learning_rate":0.00001,
            "decay_steps":82000,
            "power":1
        }
    }

}